Name,التقنيات,الرخصة,الكود المصدري,الوصف بالإنجليزية,الوصف بالعربية,حالة المشروع,روابط,مفتوح المصدر,نوع المبادرة,وسوم
Arabic Word Embeddings Word2vec,"JavaScript, HTML, Python, CSS",بدون ترخيص,https://github.com/rozester/Arabic-Word-Embeddings-Word2vec,Arabic Word Embeddings Word2vec,تطبيق ويب لتوليد واستعراض تمثيلات الكلمات (Word Embeddings) العربية باستخدام Word2vec,ميت ☠️,https://github.com/rozester/Arabic-Word-Embeddings-Word2vec,Yes,تطبيق ويب,"python, nlp, flask, ai, word2vec, word-embeddings, arabic"
raqin,"JavaScript, Vue, HTML, SCSS, Shell, Dockerfile",بدون ترخيص,https://github.com/Fahad-Alsaidi/raqin,Raqin is a comprehensive digital platform for Quranic sciences and Arabic language learning.,منصة رقمية شاملة لعلوم القرآن وتعلم اللغة العربية,ميت ☠️,https://github.com/Fahad-Alsaidi/raqin,Yes,منصة رقمية,"قرآن, علوم القرآن, لغة عربية, منصة تعليمية"
Arabic_OCR,"Python, HTML",بدون ترخيص,https://github.com/maidaly/Arabic_OCR,This repo contains Arabic OCR App,تطبيق للتعرف البصري على الحروف العربية (OCR),متوقف صيانته 😑,https://github.com/maidaly/Arabic_OCR,Yes,تطبيق,"OCR, تعرف بصري, لغة عربية, Python"
ARBML,"Python, Jupyter Notebook, JavaScript, CSS",MIT (للمكتبات التابعة),https://github.com/ARBML,"ARBML is an open-source initiative aiming to accelerate Arabic NLP research and development through shared tools, models, and datasets.",مبادرة مفتوحة المصدر تهدف إلى تسريع البحث والتطوير في معالجة اللغة العربية عبر أدوات ونماذج ومجموعات بيانات مشتركة,نشط 🚀,https://github.com/ARBML,Yes,منظمة / مجموعة مشاريع,"معالجة لغة طبيعية, عربية, NLP, ذكاء اصطناعي, مفتوح المصدر"
Arabic NLP,Python,بدون ترخيص,https://github.com/SemanticFrontiers/ArabicNLP,Collection of various Arabic NLP and Text Processing Scripts and Utilities,مجموعة من السكريبتات والأدوات المتنوعة لمعالجة النصوص العربية,ميت ☠️,https://github.com/SemanticFrontiers/ArabicNLP,Yes,سكريبت برمجي,"معالجة لغة طبيعية, نصوص عربية, سكريبتات"
Arabic-OCR,Python,MIT,https://github.com/HusseinYoussef/Arabic-OCR,OCR system for Arabic language that converts images of typed text to machine-encoded text.,نظام OCR للغة العربية يحول صور النص المكتوب إلى نص مشفر آليًا,متوقف صيانته 😑,https://github.com/HusseinYoussef/Arabic-OCR,Yes,تطبيق,"machine-learning, ocr, computer-vision, neural-network, scikit-learn, image-processing, dataset, segmentation, arabic, opencv-python, character-segmentation"
Arabic Handwriting Recognition Using Neural Network in MATLAB,"Matlab, Neural Networks, Text Recognition",بدون ترخيص,https://github.com/JubbaSmail/Arabic-Handwriting-Recognition-Using-Matlab,"Handwriting recognition is the ability of a computer to receive and interpret intelligible handwritten input. This project use Neural Network toolbox in Matlab to train NN with pre registered words, the input to NN is a word (not seperated characters), the word converted to a vector to find the perfect match with other pre-registered words, The input to the project is an image file and the final result saved on a notepad txt file.",التعرف على خط اليد هو قدرة الكمبيوتر على استقبال وتفسير المدخلات المكتوبة بخط اليد. هذا المشروع ينفذ التعرف على الكلمات العربية المكتوبة بخط اليد باستخدام الشبكات العصبية في MATLAB,ميت ☠️,http://www.imljh.com/projects/arabichwr/index.xml,Yes,مشروع أكاديمي,"اكتشاف النصوص, اللغة عربية, خط اليد"
Arabic-NER,"GRU Architecture, NER",بدون ترخيص,https://github.com/HassanAzzam/Arabic-NER,"The Arabic Named Entity Recognition (Arabic-NER) model utilizes the concept of Named Entity Recognition to tag words in Arabic texts. It features a bi-directional GRU architecture (one forward and one backward) along with a CRF layer. The model is trained on the ANERCorp dataset and employs FastText's Arabic vectors for word embedding. It has 20 training epochs and an accuracy of 94.2%. The classification report shows high precision for the LOC category (0.99), with lower precision for PERSON (0.74), ORGANIZATION (0.64), and MISC (0.63).",نموذج التعرف على الكيانات المسماة باللغة العربية (Arabic-NER) يستخدم مفهوم التعرف على الكيانات لتعليم الكلمات في النصوص العربية. يعتمد تصميمه على وحدات GRU الثنائية الاتجاه (إحداها للأمام والأخرى للخلف) مع طبقة CRF. تم تدريب النموذج على مجموعة بيانات ANERCorp، ويستخدم متجهات FastText باللغة العربية للتضمين. عدد الفترات التدريبية هو 20، ودقة النموذج تبلغ 94.2%. تشمل تقارير التصنيف دقة عالية لفئة المواقع (0.99)، بينما كانت دقة فئات الأشخاص (0.74) والمنظمات (0.64) والمعلومات العامة (0.63) أقل.,متوقف صيانته 😑,https://github.com/HassanAzzam/Arabic-NER,Yes,Model,"أنواع الأعيان, أنواع الكلمات, اللغة عربية, تحليل صرفي"
Arabic-Font-Detector,"Jupyter Notebook, Machine learning, Python",MIT,https://github.com/d7miiZ/Arabic-Font-Detector,"This model detects arabic fonts (نسخ, رقعة) given a picture of the text, Live",محرك لقراءة الخطوط العربية (النسخ و الرقعة),متوقف صيانته 😑,https://calbot.hawzen.me/,Yes,"تطبيق ويب, سكريبت برمجي",اللغة عربية
Arabic TTS ( الناطق العربي ),"Machine learning, Shell",MIT,https://github.com/asrajeh/arabic-tts,http://www.festvox.org/ voice trained on http://en.arabicspeechcorpus.com/,نظام تحويل النص العربي إلى كلام باستخدام محرك Festvox المدرب على مجموعة البيانات العربية للكلام,ميت ☠️,http://asrajeh.ddns.net/tts/,Yes,TTS,اللغة عربية
Klaam,"Jupyter Notebook, Machine learning, Python, Speech recognition",MIT,https://github.com/ARBML/klaam,"Arabic speech recognition, classification and text-to-speech using many 
advanced models like wave2vec and fastspeech2. This repository allows 
training and prediction using pretrained models.",نظام تعرف على الكلام العربي، تصنيفه، وتحويل النص إلى كلام باستخدام نماذج متقدمة مثل Wave2Vec وFastSpeech2. يوفر ادوات للتدريب والتنبؤ باستخدام نماذج مدربة مسبقاً لتحسين الأداء في مهام التعرف على الكلام وتحويل النص إلى صوت.,متوقف صيانته 😑,https://github.com/ARBML/klaam,Yes,"CLI, مكتبة برمجية",مكتبة
Arabic Speech Corpus,"Database, Docker, Machine learning, Python, Speech recognition",CC Attribution 4.0 International License,https://github.com/nawarhalabi/festival-tts-arabic-voices-docker,"This Speech corpus has been developed as part of PhD work carried out by https://uk.linkedin.com/pub/nawar-halabi/65/532/67b at the http://www.southampton.ac.uk/. The corpus was recorded in south Levantine Arabic (Damascian accent) using a professional studio. Synthesized speech as an output using this corpus has produced a high quality, natural voice.",تم بناء قاعدة البيانات هذه كجزء من اطروحة دكتوراة https://uk.linkedin.com/pub/nawar-halabi/65/532/67b في http://www.southampton.ac.uk/. تم تسجيل قاعدة البيانات هذه في استوديو احترافي بلهجة دمشقية. تم استخدام قاعدة البيانات هذه لتركيب كلام منطوق أوتوماتيكيا ذي جودة عالية.,متوقف صيانته 😑,https://ar.arabicspeechcorpus.com/,Yes,"CLI, قاعدة بيانات, مكتبة برمجية","أصوات, اللغة عربية"
arabic-tacotron-tts,"Machine learning, Python",MIT,https://github.com/youssefsharief/arabic-tacotron-tts,End to end Arabic TTS system based on tacotron,نظام tts عربي مبني علي تاكتورون,متوقف صيانته 😑,https://github.com/youssefsharief/arabic-tacotron-tts,Yes,"TTS, مكتبة برمجية",اللغة عربية
languagetool-tools-ar,Java,LGPL-2.1 license,https://github.com/sohaibafifi/languagetool-tools-ar,Dev Tools for Arabic and LanguageTool,أدوات تطوير للغة العربية ولـ LanguageTool,ميت ☠️,https://github.com/sohaibafifi/languagetool-tools-ar,Yes,سكريبت برمجي,"اضافة لمكتبة, اللغة عربية, قواعد لغوية"
"Ghalatawi, Arabic AutoCorrect","Regular expressions, Python, Shell",GPL,http://ghalatawi.sourceforge.net/,"Arabic auto-correct word lists and regular expressions for common Arabic spelling/typing errors (confusion between Alef forms, missing Yeh dots, etc.). A project by Taha Zerrouki (linuxscout).",قوائم تصحيح تلقائي للكلمات العربية وتعبيرات منتظمة للأخطاء الإملائية الشائعة في الكتابة العربية (الخلط بين الألفات والهاء والتاء المربوطة وغيرها),ميت ☠️,http://ghalatawi.sourceforge.net/,Yes,قواميس وأدوات,"تصحيح إملائي, SourceForge, قوالب, تعابير منتظمة"
duali,"C, C++, Makefile, Python","BSD 3-Clause, BSD license",https://gitlab.com/arabeyes-dev/duali,Arabic spellchecker,تصحيح إملائي عربي,ميت ☠️,https://gitlab.com/arabeyes-dev/duali,Yes,مكتبة برمجية,"تدقيق إملائي, عربي, تصحيح إملائي"
shakkelha,"Dataset, Jupyter Notebook, NLP, Neural Networks, Python",MIT,https://github.com/AliOsm/shakkelha,Neural Arabic text diacritization,التشكيل العصبي للنصوص العربية,متوقف صيانته 😑,"https://shakkelha.up.railway.app/, https://aclanthology.org/D19-5229/",Yes,"CLI, Model, مكتبة برمجية, ورقة بحثية","التشكيل, اللغة عربية, معالجة اللغة الطبيعية"
arabic-text-diacritization,"Dataset, NLP, Python",MIT,https://github.com/AliOsm/arabic-text-diacritization,Benchmark Arabic text diacritization dataset,مجموعة بيانات مرجعية لتصحيح أخطاء كتابة النصوص العربية,نشط 🚀,https://arxiv.org/abs/1905.01965,Yes,"Model, قاعدة بيانات, مصادر, ورقة بحثية","التشكيل, اللغة عربية, معالجة اللغة الطبيعية"
mishkal,"NLP, Python, Web",GPL-3.0 License,https://github.com/linuxscout/mishkal,Mishkal Arabic text vocalization software,مشكال لتشكيل النصوص العربية,نشط 🚀,http://www.tahadz.com/mishkal/main,Yes,"CLI, تطبيق ويب, مكتبة برمجية","التشكيل, اللغة عربية, معالجة اللغة الطبيعية"
Shakkala,"Deep Learning, NLP, Python",MIT,https://github.com/Barqawiz/Shakkala,"The Shakkala project presents a recurrent neural network for Arabic text vocalization that automatically forms Arabic characters (تشكيل الحروف) to enhance text-to-speech systems. The model can also be used in other applications such as improving search results. In the beta version, the model was trained on over a million sentences, including a majority of historical Arabic data from books and some modern data from the internet. The accuracy of the model reached up to 95%, and in some data sets it achieved even higher levels of accuracy depending on complexity and data distribution. This innovative approach has the potential to significantly improve the quality of writing and text-to-speech systems for the Arabic language.",التشكيل الالي للنصوص العربية,متوقف صيانته 😑,"https://ahmadai.com/shakkala/, https://arxiv.org/abs/1905.01965",Yes,مكتبة برمجية,"التشكيل, اللغة عربية, معالجة اللغة الطبيعية"
jsastem,"JavaScript, Shell, Python",بدون ترخيص,https://github.com/ejtaal/jsastem,JavaScript Arabic Stemmer,أداة تجذيع (Stemming) للغة العربية مكتوبة بجافاسكريبت,ميت ☠️,https://github.com/ejtaal/jsastem,Yes,مكتبة برمجية,"تجذيع, جافاسكريبت, معالجة لغة طبيعية"
arabicstemmer,"Makefile, Python, Snowball",BSD license,https://github.com/assem-ch/arabicstemmer,An algorithm for Arabic stemming written on Snowball framework language. If offers light stemming and text normalization.,هذه خوارزمية لكتابة النصوص العربية مكتوبة بلغة إطار عمل Snowball. وهي توفر كتابة نصية بسيطة وتطبيع النص.,متوقف صيانته 😑,https://arabicstemmer.com/,Yes,"CLI, تطبيق ويب, مكتبة برمجية","اللغة عربية, ايجاد جزور الكلمات, معالجة اللغة الطبيعية, ويب"
Sarf,"Gherkin, Java, NLP, Web",MIT,https://github.com/alsaydi/sarf,Arabic Morphology System,نظام الاشتقاق والتصريف في اللغة العربية,ميت ☠️,"https://sarf.one/, https://ossl.alecso.org/affich_oso_details.php?id=55, https://sourceforge.net/projects/sarf/files/sarf/sarf%201.0/",Yes,"تطبيق ويب, مستندات ووثائق, ورقة بحثية","اللغة عربية, تحليل صرفي, معالجة اللغة الطبيعية, ويب"
Wojood - Nested Arabic NER,"Dataset, Machine learning, NLP, Python",MIT,https://github.com/SinaLab/ArabicNER,Wojood is a corpus for Arabic nested Named Entity Recognition (NER). Nested entities occur when one entity mention is embedded inside another entity mention.,Wojood عبارة عن مجموعة من النصوص للتعرف على الكيانات المسماة المتداخلة (NER) باللغة العربية. تحدث الكيانات المتداخلة عندما يتم تضمين ذكر كيان داخل ذكر كيان آخر.,نشط 🚀,https://sina.birzeit.edu/wojood/,Yes,"Model, مكتبة برمجية, ورقة بحثية","اللغة عربية, محررات نصوص"
alankaa,"Dataset, Machine learning, NLP",بدون ترخيص,https://alankaa.com/,Organize all modern Arabic dialects and make ties to the ancient ones.,تنظيم كافة اللهجات العربية الحديثة وربطها باللهجات القديمة.,نشط 🚀,https://alankaa.com/project/index.php,Yes,"تطبيق ويب, فريق مبادر, قاعدة بيانات, مستندات ووثائق","اللغة عربية, توثيقات, فهرس, قاعدة بيانات, معجم, مكتبة"
Qutrub,"NLP, Python",License,https://github.com/linuxscout/qutrub,Arabic verb conjugation software,تصريف الأفعال العربية,متوقف صيانته 😑,https://tahadz.com/homepage/ar/p/qutrub/,Yes,"Model, مكتبة برمجية","اللغة عربية, محررات نصوص"
Arabic Poem Generator,"Dataset, Jupyter Notebook, Python",MIT,https://github.com/hayderkharrufa/arabic_poem_generator,Generating Arabic poetry using Markov chains.,توليد الشعر العربي باستخدام سلاسل ماركوف.,ميت ☠️,"https://www.youtube.com/watch?v=Dnx6bE4Nwyo, https://www.kaggle.com/datasets/ahmedabelal/arabic-poetry",Yes,"Model, سكريبت برمجي","اللغة عربية, شعر"
Alif Type (حروف ألف),"Makefile, Python, SCSS, Tex","OFL, GPL, MIT",https://github.com/aliftype,"Alif Type is a type foundry founded by Khaled Hosny, and specializes in Arabic and mathematical typefaces.",«حروف ألف» هو مسبك حروف رقمي أسسه خالد حسني، ويتخصص في الخطوط العربية والرياضياتية.,نشط 🚀,https://aliftype.com/,Yes,"خط عربي, فريق مبادر, مجتمع, مكتبة برمجية","اللغة عربية, خط"
Khotot,خط (Font),GNU General Public License v2.0,https://gitlab.com/arabeyes-art/khotot,Khotot project aims at increasing the number of available Arabic free and open source fonts.,يهدف https://www.arabeyes.org/Khotot إلى بناء خطوط عربيّة حرّة مع دعم أفضل لخصائص القلم العربي، وتجميع الخطوط العربية الحرّة في مكان واحد.,ميت ☠️,"https://www.arabeyes.org/Khotot, https://www.arabeyes.org/%D8%AE%D8%B7%D9%88%D8%B7",Yes,"خط عربي, فريق مبادر","اللغة عربية, خط"
Nimra,خط (Font),OFL-1.1 License,https://github.com/aiaf/nimra,Nimra is a typeface with MICR Eastern Arabic numerals in the style of E13B,خط رقمي لأرقام MICR العربية على نمط E13B,ميت ☠️,https://makkuk.com/nimra/,Yes,خط عربي,"اللغة عربية, خط"
Cairo,"Makefile, Python, Shell",OFL-1.1 License,https://github.com/Gue3bara/Cairo,"Cairo is a contemporary Arabic and Latin typeface family. Extending the famous Latin typeface family Titillum Web to support the Arabic script, with a design that is based on the Kufi calligraphic style. Cairo balances classic and contemporary tastes with wide open counters and short ascenders and descenders that minimize length while maintaining easy readability. The lighter weights can be used for body text while the heavier weights are perfect for headlines and display typography. Each font includes stylistic ligatures and the Arabic component has a wide glyph set that supports the Arabic, Farsi and Urdu languages.",كايرو هو عائلة خطوط عربية لاتينية معاصرة، إمتداداً لعائلة الخطوط اللاتينية الشهيرة Titillum Web ليدعم اللغة العربية، بتصميم مبني على الخط الكوفي الكلاسيكي. خط كايرو يوازن بين الذوقين الكلاسيكي والمعاصر بمداور حروف مفتوحة وواسعة بين محددات عليا ودنيا قصيرة للحروف والتي تقلل من ارتفاع الحروف دون التأثير سلبا على المقروئية. الأوزان الخفيفة من الخط يمكن إستخدامها في كتابة متن المواضيع بينما الأوزان السميكة مناسبة أكثر للعناوين العريضة. خط كايرو يحوي مكتبة حروف غنية تدعم العربية، الأردو والفارسية وبمكتبة تشكيل كاملة ويصدر بستة أوزان مختلفة.,متوقف صيانته 😑,https://gaber.design/cairo-free-font-family,Yes,خط عربي,"اللغة عربية, خط"
خط أسس (خط للأكواد العربية),خط (Font),بدون ترخيص,,Monospace font for Arabic code that may contain Latin-like text. It was built mainly for the code editor of Alusus programming language but can be used as other use cases.,خط أسس أحادي المسافة، صمم بشكل رئيسي لمحررات أكواد لغة الأسس وهو متاح الآن لستخدمه كيفما تشاء ومع أي لغة أحببت.,ميت ☠️,https://community.alusus.org/t/kht-erby-jdyd-thabt-alerd-mwnw/23,Yes,خط عربي,"اللغة عربية, تقنية, خط, فونت, ويب"
Kawkab Mono,خط (Font),OFL-1.1 License,https://github.com/aiaf/kawkab-mono,"Kawkab Mono (كوكب مونو) is a monospaced Arabic typeface. It's designed for code and text-editing in particular, and whenever having a fixed-pitch font is necessary, such as when composing tabular data using text. There's a dearth in monospaced Arabic fonts and Kawkab comes to fill a void in this niche.",كوكب مونو هو خط عربي ثابت عرض المحارف (monospaced typeface) صمم لاستخدامات عديدة تشمل تحرير النصوص البرمجية والنثرية أو عندما يكون ثبات عرض المحرف ضروريًا كما عند إنشاء الجداول النصية أو نماذج التعبئة الورقية. تعد هذه الفئة من الخطوط نادرة جدًا في الخط العربي ويأتي كوكب مونو ليسد شيئًا من ذلك الفراغ.,متوقف صيانته 😑,https://makkuk.com/kawkab-mono/,Yes,خط عربي,"اللغة عربية, خط"
دليل أسلوب كتابة المحتوى (Content Style Guide),"CSS, Markdown",MIT,https://csg.uxwritingar.com/,"Arabic Content Style Guide - open source guide for content writing in Arabic, focusing on UX writing best practices.",أهلًا بك في دليل أسلوب كتابة المحتوى (Content Style Guide) - الإصدارة الأولى، هذا الدليل (مفتوح المصدر) مساهمة لإثراء مجال كتابة تجربة المستخدم (UX Writing) وتصميم المحتوى (Content Design) باللغة العربية، يمكنك المساهمة معنا في إضافة أو تعديل وكذلك تحسين الدليل بإتباع التعليمات على موقع Github.,متوقف صيانته 😑,https://github.com/UX-Writing/Content-Style-Guide-in-Arabic,Yes,"تعليم, مستندات ووثائق","اللغة عربية, تحسين تجربة المستخدم, تعليم, تقنية, توثيقات"
Arabic Initiative for User Experience (AIUX),SCSS,بدون ترخيص,https://github.com/KL13NT/AIUX,The Arabic Initiative for User Experience (AIUX) is an idea for building a better world for Arabic-speaking users. It outlines ways in which the Arabic community could enhance existing tooling and content to provide a better UX for Arabic-speaking users.,المبادرة العربية لتجربة المستخدم هي مبادرة تهدف لبناء عالم أفضل للمتحدثين بالعربية. هي مبادرة تدفع باتجاه تحسين الأدوات المتاحة والحث على أهمية الاعتناء بتفاصيل التجربة وتحسينها.,ميت ☠️,https://kl13nt.github.io/AIUX,Yes,فريق مبادر,"اللغة عربية, تحسين تجربة المستخدم, تقنية"
Osman Readability Metric,Java,بدون ترخيص,https://github.com/drelhaj/OsmanReadability,"OSMAN is an open-source Java tool designed for calculating the readability of Arabic text, supporting both text with and without diacritics (Tashkeel). It provides an efficient method for estimating syllables and calculating readability, even when diacritics are absent. The tool was originally published as a paper at LREC 2016 and has been updated in 2020 for improved performance and to avoid copyright issues with previous dependencies. It also offers functionality to compute other readability metrics like ARI and LIX.",OSMAN هو أداة مفتوحة المصدر مكتوبة بلغة Java لقياس قابلية قراءة النصوص العربية، سواء كانت مشكولة أو غير مشكولة. توفر طريقة فعالة لتقدير المقاطع الصوتية وحساب درجة الوضوح حتى عند غياب التشكيل. تم نشر الأداة لأول مرة في ورقة بحثية في LREC 2016 وتم تحديثها في عام 2020 لتحسين الأداء وتجنب مشاكل حقوق الطبع. كما تدعم حساب مؤشرات قراءة أخرى مثل ARI و LIX.,نشط 🚀,https://www.lancaster.ac.uk/staff/elhaj/docs/elhajlrec2016Arabic.pdf,Yes,CLI,اللغة عربية
مجتمع أسس,"CSS, HTML, JavaScript, Shell Script","GPL, MIT وغيرها (حسب المشروع)",https://github.com/aosus,Aosus is the biggest (as they say) Arabic FOSS community.,أسس مجتمع غير ربحي يهدف إلى نشر فكرة وثقافة البرمجيات الحرة والمفتوحة المصدر في الوطن العربي,نشط 🚀,"https://aosus.org/, https://t.me/aosus, https://twitter.com/2linuxorg, https://mastodon.online/@aosus, https://www.facebook.com/aosus1, https://www.linkedin.com/company/aosus",Yes,"فريق مبادر, مجتمع","برمجيات حرة, مفتوح المصدر, مجتمع عربي, Linux, أسس"
أعجوبة,"HTML, Python, Shell Script",رخصة وقف من أعجوبة,https://github.com/ojuba-org,"http://ojuba.org/ is an Arabic platform focused on promoting free and open-source software. It offers tutorials, resources, and community discussions around Linux, open-source tools, and software freedom. The site aims to support Arabic-speaking users in adopting and using these technologies in their personal and professional lives.","موقع ""أجوبة"" هو منصة عربية حرة تقدم محتوى متنوع في مجالات مثل البرمجيات الحرة، أنظمة التشغيل، والبرمجيات مفتوحة المصدر. يهدف الموقع إلى تعزيز استخدام البرمجيات الحرة بين المستخدمين العرب ويوفر شروحات ودروساً حول كيفية الاستفادة منها في حياتهم اليومية أو في عملهم.",ميت ☠️,"https://ojuba.org/, https://x.com/ojuba_org",Yes,"فريق مبادر, مجتمع","إسلام, اللغة عربية, توثيقات, فهرس, معجم, مكتبة, نظام تشغيل"
