Name,التقنيات,الرخصة,الكود المصدري,الوصف بالإنجليزية,الوصف بالعربية,حالة المشروع,روابط,مفتوح المصدر,نوع المبادرة,وسوم
اسماء.شبكة,اسم نطاق,بدون ترخيص,,An Arabic top-level domain initiative enabling Arabic speakers to use Arabic script in website addresses.,عبر .شبكة، هناك إمكانية أن يتواصل أكثر من 380 مليون ناطق باللغة العربية في منطقة الشرق الأوسط وشمال أفريقيا فقط! ومن المعروف أن العربية هي اللغة الخامسة على مستوى العالم من حيث عدد الناطقين بها والأسرع انتشاراً على الإنترنت (فقد حققت نمواً ملحوظاً بمعدل 2500% في السنوات العشرة المنتهية في العام 2011 مقارنة باللغة الإنجليزية التي سجلت معدل 300% في الفترة نفسها).,نشط 🚀,https://xn--ggbla1c4e.xn--ngbc5azd/,Yes,"اسم نطاق, خدمات سحابية","اسم النطاق, برمجة, خدمات سحابية, ويب"
بالعربي.مصر,اسم نطاق,بدون ترخيص,,"The "".مصر"" domain is an Arabic top-level domain allowing businesses and individuals to register website addresses using Arabic characters instead of Latin ones like "".com"". It aims to make the internet more accessible to Arabic speakers, offering opportunities to claim domain names previously unavailable in other extensions. The service is regulated by Egypt’s National Telecom Regulatory Authority, with rules on intellectual property and content. ""Link Datacenter"" provides registration and hosting services, leveraging its extensive experience in the Egyptian domain market.","دومين "".مصر"" هو نطاق علوي دولي مخصص لاستخدام اللغة العربية في عناوين المواقع الإلكترونية. يسمح للشركات والأفراد بتسجيل أسماء نطاقات باستخدام الحروف العربية بدلًا من اللاتينية مثل "".com"". هذه الخطوة تسهّل استخدام الإنترنت في المجتمعات الناطقة بالعربية، وتفتح المجال لحجز أسماء نطاقات لم تعد متاحة على النطاقات التقليدية. يُشترط الالتزام بالقواعد القانونية والتنظيمية لضمان حماية حقوق الملكية الفكرية. شركة ""لينك داتاسنتر"" تقدم خدمات تسجيل واستضافة لهذه النطاقات نظرًا لخبرتها الواسعة في السوق المصري.",ميت ☠️,https://web.archive.org/web/20210613173631/http://xn--mgbbb9a1b0d2b.xn--wgbh1c/,Yes,"اسم نطاق, خدمات سحابية","اسم النطاق, برمجة, خدمات سحابية, ويب"
Ara,Machine learning,MIT,https://github.com/latiif/ara,A command line tool that correctly displays Arabic text in terminals.,A command line tool that correctly displays Arabic text in terminals. Check releases and download the binary directly. Get the binary and add it to your $PATH wget https://github.com/latiif/ara/releases/download/v0.7/ara && chmod +x ara 🆕 Undotting of Arabic letters (Rasm). 🆕 Revamped command line interface.,متوقف صيانته 😑,https://github.com/latiif/ara,Yes,CLI,"اللغة عربية, برمجة"
Tafqit,JavaScript,MIT,https://github.com/MohsenAlyafei/tafqit,"Tafqit is an open-source JavaScript library designed to convert numbers into Arabic text using the ""Tafqit"" system. It supports both integer and decimal numbers, converting them into Arabic words, such as turning ""123"" into ""مئة وثلاثة وعشرون"". This library is useful for applications like invoices, financial documents, or any app requiring number-to-text conversion in Arabic.","مكتبة “تفقيط” هي مكتبة جافاسكريبت مفتوحة المصدر تهدف إلى تحويل الأرقام إلى نصوص باللغة العربية باستخدام نظام ""تفقيط"". يمكن للمكتبة التعامل مع الأرقام الصحيحة والأرقام العشرية، وتحويلها إلى كلمات عربية مثل تحويل الرقم ""123"" إلى ""مئة وثلاثة وعشرون"". تُعد هذه المكتبة مفيدة في تطبيقات مثل الفواتير، المستندات المالية، أو أي تطبيق يتطلب كتابة الأرقام بالحروف العربية.",ميت ☠️,https://github.com/MohsenAlyafei/tafqit,Yes,مكتبة برمجية,"اللغة عربية, برمجة, مكتبة, ويب"
Hillal Linux,Linux,بدون ترخيص,https://github.com/mhsabbagh/helallinux,Official code repository for the Helal Linux project.,توزيعة لينكس عربية مبنية على دبيان تهدف لتوفير بيئة عربية متكاملة,ميت ☠️,http://helallinux.com,Yes,نظام تشغيل,"برمجة, نظام تشغيل"
Mujallad مجلّد,"Flask, Markdown, Python",GPL-2.0,https://github.com/mhsabbagh/mujallad,A simple script that helps create bilingual (Arabic/English) Gitbook-style documentation sites.,إذا حاولت من قبل البحث عن طريقة لجعل Gitbook يدعم العربية ولم تجد، أو إذا ما كنت قد بحثت عن أي سكربت محتوى بسيط يدعم اللغة العربية ليقرأ ملفّات Markdown ويعرضها على شكل كتاب ولم تجد كذلك، فحينها ستسرّ عندما تتعرف إلى سكربت مجلّد. سكربت مجلّد هو تطبيق ويب مكتوب ببايثون وإطار العمل فلاسك.,ميت ☠️,https://mujallad.mhsabbagh.com/,Yes,"تعليم, مستندات ووثائق",توثيقات
RTL Styling,"CSS, HTML",بدون ترخيص,https://rtlstyling.com/posts/rtl-styling,"Do you like my content? You can support and buy me a coffee. Thank you so much! Over 292 million people around the world speak Arabic as their first language. Arabic (al-Arabiyyah, pronounced /al ʕarabijja/, /ʕarabiː/) is my native language, and I sometimes build websites that need to support both left-to-right (LTR) and right-to-left (RTL) styles.",دليل شامل لتصميم واجهات المستخدم من اليمين إلى اليسار (RTL) للمبتدئين والمحترفين,ميت ☠️,https://rtlstyling.com/posts/rtl-styling,Yes,مدونة / دليل,"اللغة عربية, تعليم, ويب"
Arabic APIs,"API, فهرس",MIT,https://github.com/AqeelAT/arabic-apis,A collective list of Arabic APIs,قائمة تشاركية لجمع الواجهات البرمجية العربية في مكان واحد هذه الفكرة مستوحاه من مشروع Public Apis أرجو منك المشاركة في اضافة الواجهات إلى هذه القائمة، سواء بمشاركة واجهات تعرفها، أو بإنشاء واجهات جديدة لملئ الفراغ التقني العربي.,ميت ☠️,https://github.com/AqeelAT/arabic-apis,Yes,فهرس,"برمجة, فهرس"
SimpleMDE - Markdown Editor (RTL),"JavaScript, CSS",بدون ترخيص,https://github.com/imAbdelhadi/simplemde-rtl,Full RTL version of SimpleMDE - Markdown Editor,"Full RTL version of SimpleMDE Markdown Editor for Arabic, Persian, and Urdu languages. npm install simplemde-rtl --save Via jsDelivr. Please note, jsDelivr may take a few days to update to the latest release.",ميت ☠️,https://github.com/imAbdelhadi/simplemde-rtl,Yes,مكتبة برمجية,محررات نصوص
Arabic voices for Festival TTS,"Machine learning, Python, Scheme, Speech recognition",GPL-3.0 License,https://github.com/linuxscout/festival-tts-arabic-voices,Arabic voices for Festival TTS,أصوات عربية لـ Festival TTS,ميت ☠️,https://github.com/linuxscout/festival-tts-arabic-voices,Yes,"Model, سكريبت برمجي, مكتبة برمجية","أصوات, اللغة عربية"
Ar-PHP,"Backend, PHP, Web",GNU LGPL,https://github.com/khaled-alshamaa/ar-php,"Our mission is to develop open-source solutions and provide professional support to help small and medium businesses tackle the challenges of building professional Arabic websites using PHP and MySQL databases. The library we are developing aids our partners in saving time and enhancing efficiency.

This project offers a set of tools that enables Arabic website developers to deliver professional search, display, and content processing in Arabic using PHP.","مهمتنا هي تطوير حلول مفتوحة المصدر وتقديم دعم احترافي لمساعدة الشركات الصغيرة والمتوسطة في مواجهة التحديات التي ترافق تطوير مواقع عربية احترافية بلغة PHP وقاعدة MySQL للبيانات، حيث تساعد المكتبة التي نطورها شركائنا على اختصار الزمن وزيادة الفعالية.
يقدم هذا المشروع مجموعة من الأدوات التي تمكن مطوري المواقع العربية من تقديم بحث وعرض ومعالجة إحترافية للمحتوى العربي بلغة PHP.",نشط 🚀,"https://ar-php.org/, https://www.youtube.com/watch?v=P4zV1Iu5QcE",Yes,مكتبة برمجية,"اللغة عربية, برمجة, تاريخ وزمن, تفقيط, مكتبة, ويب"
خدمات اللغة العربية,"Java, JavaScript, TypeScript",AGPL-3.0 License,https://github.com/Seen-Arabic/Arabic-Services,"Arabic Services is a versatile library offering utility functions for processing and transforming Arabic text. Features include removing diacritics, removing elongation characters, converting text to old Arabic script, and replacing banned words with visually similar characters.",خدمات اللغة العربية هي مكتبة برمجية متعددة الاستخدامات تقدم وظائف مساعدة لمعالجة وتحويل النصوص العربية. تشمل الميزات إزالة التشكيل، إزالة التطويل، تحويل النص إلى الخط العربي القديم، واستبدال الكلمات المحظورة بحروف مشابهة بصريًا.,نشط 🚀,"https://github.com/Seen-Arabic/Arabic-Services-JavaScript/, https://github.com/Seen-Arabic/Arabic-Services-Java, https://arabic-services-api-v1.onrender.com/docs, https://www.npmjs.com/package/arabic-services, https://central.sonatype.com/artifact/io.github.seen-arabic/arabic-services",Yes,"تطبيق ويب, مكتبة برمجية","التشكيل, اللغة عربية, معالجة اللغة الطبيعية"
Quran Align,"C++, CMU Sphinx, Linux, Python","CC Attribution 4.0 International License, MIT",https://github.com/cpfair/quran-align,"A tool for producing word-precise segmentation of recorded Qur'anic recitation. Designed to work with http://everyayah.com/ style audio input.

Each word in the Qur'an is assigned a precise start and end timestamp within the recorded audio of the ayah. You can use this data to highlight the word currently being spoken during playback, to repeat a certain word or phrase, to compare against other audio, to analyze a qari's speaking cadence, and so on.","أداة لتحديد مواضع الكلمات بدقة في تسجيلات تلاوة القرآن الكريم. مصممة للعمل مع مدخلات الصوت بأسلوب EveryAyah.

يتم تخصيص توقيت بداية ونهاية دقيقين لكل كلمة في القرآن ضمن التسجيل الصوتي للآية. يمكنك استخدام هذه البيانات لتحديد الكلمة التي تُتلى حاليًا أثناء التشغيل، تكرار كلمة أو عبارة معينة، المقارنة مع تسجيلات أخرى، تحليل سرعة التلاوة للقارئ، وغيرها من الاستخدامات.",ميت ☠️,https://github.com/cpfair/quran-align/releases/tag/release-2016-11-24,Yes,"CLI, Model, قاعدة بيانات","أصوات, إسلام, القرآن الكريم, تلاوات"
Dorar.net Hadith API,"API, Express.JS, Hadith, JSON, JavaScript, Node.JS",MIT,https://github.com/AhmedElTabarani/dorar-hadith-api,API for dorar.net,API وسيط للـدرر السنية,نشط 🚀,https://github.com/AhmedElTabarani/dorar-hadith-api,Yes,"RESTful API, سكريبت برمجي",الحديث النبوي
Sunnah Hadith API,"API, Express.JS, Hadith, JSON, JavaScript, Node.JS",MIT,https://github.com/AhmedElTabarani/sunnah-hadith-api,This is a simple API that scrapping data from the sunnah.com website. This API provide translation of the arabic hadith in English (Mainly English),"هذا API بسيطة يقوم بسحب البيانات من موقع http://sunnah.com/
ميزته أنه يوفر البحث عن الاحاديث سواء بنص عربي أو انجليزي والنتائج تكون مترجمة باللغة العربية والإنجليزية",نشط 🚀,https://github.com/AhmedElTabarani/sunnah-hadith-api,Yes,"RESTful API, سكريبت برمجي",الحديث النبوي
100 دعاء من الكتاب والسنة الصحيحة,"Azkar, JSON",MIT,https://github.com/AhmedElTabarani/100-duaa-from-the-book-and-authentic-sunnah,"The book 100 Supplications from the Qur’an and the Authentic Sunnah is a book that contains 100 supplications from the Qur’an and the Authentic Sunnah, and they were compiled by Sheikh Muhammad Salih Al-Munajjid.",كتاب https://nuqayah.com/f/100-duaa.pdf هو كتاب يحتوي على 100 دعاء من الكتاب والسنة الصحيحة، وقد تم تجميعها بواسطة الشيخ محمد صالح المنجد,نشط 🚀,https://github.com/AhmedElTabarani/100-duaa-from-the-book-and-authentic-sunnah,Yes,كتاب,"أدعية, الأذكار"
Hadith Checker Extension,"Hadith, JavaScript",MIT,https://github.com/AhmedElTabarani/hadith-checker-extension,A browser extension through which you can verify whether Hadiths are authentic or fabricated,إضافة للمتصفح تستطيع من خلالها أن تتفقد الأحاديث هل هي موضوعة أو صحيحة,متوقف صيانته 😑,https://chromewebstore.google.com/detail/%D8%A7%D9%84%D8%AA%D8%AD%D9%82%D9%82-%D9%85%D9%86-%D8%A7%D9%84%D8%A3%D8%AD%D8%A7%D8%AF%D9%8A%D8%AB-hadith/cfbllcckohbiiplkigbfllfphhakanke,Yes,اضافة للمتصفحات,الحديث النبوي
Azkar Reminder Extension,"Azkar, JavaScript",MIT,https://github.com/AhmedElTabarani/azkar-reminder-extension,"A browser extension that reminds you of the supplications and prayers continuously. It contains the morning and evening supplications and is translated into English. Every so often, a random supplication will be displayed to you in the form of a notification that comes to you through the browser.",إضافة للمتصفح تتذكرك بالأذكار والأدعية بشكل مستمر وبها اذكار الصباح والمساء ومترجمة للغة الإنجليزية كل مدة يتم سيتم عرض لك دعاء عشوائي على هيئة اشعار يأتيك من خلال المتصفح,متوقف صيانته 😑,https://chromewebstore.google.com/detail/%D9%85%D8%B0%D9%83%D8%B1-%D8%A7%D9%84%D8%A3%D8%B0%D9%83%D8%A7%D8%B1/fcagcaikgffokonhlfbaainnaknhjkpp,Yes,اضافة للمتصفحات,"أدعية, الأذكار"
